Post,Response,Emotion Category
i will . i ll miss you grandma .,i ll miss you . . . .,2
my dear francis you do seem extremely uncomfortable .,i m afraid i am just a bit .,2
i don t have nothing .,well what have you got ?,3
joe . . . joe . . .,stop pressuring me . . .,4
the one on the left .,damn ! what are the odds ?,0
yes can i help you ?,where shall i pay the bill ?,0
what do you want ?,come on . let s get a drink .,4
get the hell out of here . !,now ann . . .,4
how many do you see ?,what ? ! fuck off . save yourself .,4
no thanks . what does that mean ?,i don t want to go .,3
is that a threat ?,no i mentioned it only in passing .,4
what are you saying ?,hello ? last birthday was ?,3
is it a king or a queen ?,it s a double .,2
oh dear ! has she done something wrong ?,please answer my question .,3
i thought you might want some hot coffee .,thanks just the same .,4
mom michael won t talk to me .,shouldn t he be at home ?,1
let me have a beck s .,we ain t got no beck s .,3
then how come you got the fine ?,because i m here .,4
why did you do this ?,i don t know ! i m sorry !,4
sure that would be cool . friends .,okay . see you later friend .,2
they stole . . .,they stole the . . .,3
well tell em honey .,we re getting married .,2
yes sir . can you show you identity ?,what about the driving license ?,0
you saved kendall s life,but not pike s .,2
yes it is . kelly ?,yes it s me .,0
is this taxi taken ?,no madam . may i help you ?,0
thank you . . .,. . . especially the sneakers .,2
what good ll it do ?,we ll get you out in ten minutes .,2
the hell are they ? !,they took a left at the next light !,3
some kids found you in a garbage dump .,where s my watch ? it s gone .,4
they re trying to come through the door !,everybody ! back here !,4
is it night or day erik ?,it is day of course freya .,2
you re sure we have to ?,it s not worth taking the chance john .,2
no kiddin bennie . i got gas .,ya get the special ?,4
you know andy thinks you re doing this .,doesn t that scare you ?,3
we re very lucky .,the funeral s on friday .,4
what do you want ?,a little charlie perhaps .,4
what the fuck are you . . . ?,where d you get that gun ?,2
i just called for a second .,long enough to call victoria a ho .,1
what d you do that for ?,so he can tell the story .,2
hi i m mary smith .,hello i m the landlord . john taylor .,1
as a matter of fact i am .,have you just started college ?,0
could you tell me your education background ?,sure . where shall i begin ?,0
got to think this through . . .,caesar maybe we should run,4
hey ! great advice on that joey thing !,yeah ? the work problem ?,0
all right . all right .,i couldn t go near that woman .,4
is this your first year in college ?,i actually transferred here from another school .,0
man ! that car almost hit me !,yeah that was close .,0
is this your brother in law ?,yes he married my sister ten years ago .,1
i d say about two weeks .,probably a little longer than that but whatever .,0
oh no no this place is totally healthy !,that this milk is mine .,0
i know . why ?,i like how it feels not to feel .,1
historic occasion isn t it ?,seems like we have another one every week .,2
hi honey . how was the flight ?,fine honey . stay asleep .,0
we ll talk about that later .,but . . .who . . .,4
how does it sound ?,it s hard to describe .,4
may i have two of them ?,sure . as many as you want .,0
were they bad people ?,i thought they was .,4
since when did that matter ?,let s not start that again .,4
let s say about ?,that s ok with me .,1
holy shit . get me back to manhattan .,take us right to kennedy . now .,1
you miss me don t you ?,don t push your luck dave .,0
. . .did you really say that ?,just a little joke miss farmer .,2
i have a taste for chinese food .,they have really good chow mein .,0
no problem . let me have one .,that s great . anything else ?,0
but you got four children !,i want one with you .,2
won t you join me sir ?,no my health doesn t allow it .,1
what s your problem ?,why d you jump ?,2
no thanks . i have had enough .,actually you haven t have much .,0
why do people go to war ?,why do people go to war ?,3
talk to me hudson .,uh seems to be in front and behind .,1
worst day of my life man .,well i m sold .,2
ass first into the world .,i been that way ever since .,2
but it isn t bad weather now .,better get home before it is .,0
hey don t we have to . . .,yeah we got um hmm .,0
let s watch some tv .,where are these toys of yours ?,1
he s a very sweet man .,where are you going now ?,2
no . don t be an ass .,can i be anyone i want ?,4
the police don t know who did it .,i hope this doesn t happen again .,0
will there be anything else ?,is this dress made of pure silk ?,0
ronnie . . . yeah so .,now she s going out with greg barnett ?,1
oh thank you very much .,like you ve got a grip .,4
i don t know i m afraid .,i don t know either .,4
here s your jacket !,uh thanks . . .,4
no . i think i better just go .,okay . thank you .,4
good . see you later .,thank you . good bye .,0
what is it all about ?,i saw . . .,0
took your time gettin here .,she has other things to do dave .,0
well then how much do i owe you ?,that comes to h . k . .,0
hello . where are you headed today ?,i m off to barcelona for a week .,0
i have to go .,you are frightened no ?,2
mr . webster you will help him ?,i ll do my best mary .,4
