Post,Response,Emotion Category
that s hardly a substitute .,you ll need one more hit .,4
where were you last night ?,are we going to go through this again ?,3
i don t know . they killed wes .,why haven t they killed us ! ?,2
where did you get this power ?,the power was within you .,3
least she had time for me .,so you fucked around to prove a point !,4
are you going to vote ?,of course ! are you ?,0
walter ! d did you see that ?,yes . where is he ?,4
i met a girl .,what is her name ?,4
from a rich millionaire .,that s wonderful . poor josephine .,3
what s the temperature today ?,it s about degrees centigrade .,0
you re late asshole .,fine and how are you ?,4
what do you need ?,i can t seem to find my class .,0
i live downtown with my parents .,do you have a car ?,1
what were they doing there ?,they were for the fucking boat brian .,1
what day will you need it for ?,we will only be needing it for sunday .,0
great word . towel ?,no i air dry .,3
have i slept long ?,oh you slept well don t worry .,1
i m looking for the bomb squad .,they re not here .,4
well she s tall and pretty .,is she like you ?,0
well what s the price of this route ?,that s and we will visit cities .,0
i really like where i m at now .,so why don t you just stay here ?,0
no thanks i don t smoke .,go on give em to your friends .,4
yeah sure . how much are they ?,how much is what ?,2
tomorrow will be soon enough .,and then i . . . right .,2
you can t have it .,give it to me !,2
some people went looting because of the blackout .,what do you mean ?,0
that s always fun to be .,yeah but you re making me look bad !,2
what else you got ?,let s see you got a minute ?,4
you can go to zhongshan park .,have you ever been there ?,1
of course . how can i help you ?,i am looking for a sweater .,0
who s she talking to ?,that fuckin guinea will knows him .,1
i know because i felt it myself,i wanted to fuck her that s all !,4
do you have another card i could try ?,i only have one card .,0
can i help you madam ?,yes would you keep our bags until pm .,0
what does a chinese food have ?,rice egg beef and vegetables .,0
i don t believe it took my picture .,i m just going to let you go .,0
you re looking great baby .,what re you doing later ?,2
how do you know he d buy them ?,graff ? because i worked for him .,2
you got two shirts on ?,yes mam . . .,2
we don t know .,we have to go after them find where !,2
down to the wire ?,so help me god !,4
you missed somethin ed .,i did ? i didn t see anything .,2
i agree . . .,it s beginning to spot .,0
no one . i promise .,who have you talked to ?,2
i have to stay .,no ! sit down now .,2
i don t wanta rob you ma am .,go ahead bert says take it .,4
not for a moment .,you re playing games .,1
it s up to you .,they want a fuckin war i m ready .,2
no miss ratched . . .,and yet you suspect her .,2
the hell you do .,the hell i don t .,0
the speech ? real good .,you think i got it ?,0
how have you been ?,. . . you know me ?,4
no one else is even here yet .,first in first out that s me .,4
i m at the hospital .,what s the matter ? !,2
i m going to have to keep your deposit,why can t i have it back ?,0
ok . hold on please .,ok . thank you .,0
our time s up .,what ? ! there s nothing here !,4
i don t buy that .,it s the truth .,4
are you quite sure ?,yes really thank you very much .,0
that ll be fine . thanks .,do you have any ketchup ?,0
i ll miss my bus .,this is worth it .,4
sara ? hi . it s grady .,where are you grady ? an elevator ?,4
i don t . . .,you didn t see it . . .,4
you told me you had answers .,yeah well i don t have them all .,4
just leave her alone .,i m so sorry .,3
when did you and amanda meet each other ?,i met her about one year ago .,0
hicks don t let him leave .,we ain t going anywhere .,2
they re not supposed to be here !,this was your department junior .,2
i couldn t lose him .,jim younger i told you,4
you on drugs ? huh ?,no . . . i . . .,0
the world of the dead ?,could be . . .,2
do i still need to pay the fine ?,no you don t .,1
well if it ain t duff !,how you doin ? hi there !,4
you re the first one he ll contact .,he s got my number .,3
what kind of flowers do you want ?,i have no idea .,0
what can i do for you today ?,i need to return a book .,0
uh then he be just,he just went out like light,1
i completely understand . . .,we just . . .,3
i ll go . it s my fault .,you said it not me .,1
what happened to you then ?,how d you find me ?,0
marry lin s office this is linda .,linda this is david wang .,0
mornin son . . .,mornin daddy . . .,3
why yes bill i was saying to quince,no no not you .,2
connie don t hang up .,david ? how d you get this number ?,2
so where are all your toys ?,let s watch some tv .,4
i mind you said there was two .,well shoot ! maybe there was !,2
well i am how much will that cost ?,the pass is free .,0
we re not going to do anything .,they re going to kill us !,2
three minutes thirty seconds .,distance from reliant . . .,3
will i be seeing you again ?,san francisco s a long way from here .,3
so what s the problem ?,there is no problem .,0
i love you my brother .,i love you black .,1
i got big ideas though !,i m sure you do .,0
that s great news .,your daughter is a wonderful student .,0
yes apparently four stores were broken into .,did the looters get caught ?,0
how d you know that lowell ?,it s obvious isn t it ?,4
two at a time ?,my brother and i . one each .,2
everyone who plays the game knows the rules .,that s exactly what i told myself .,0
we thought it was just .,you thought it was just .,4
i got something for you to do tomorrow .,i kind of had plans . . . .,4
twice . in the parking lot .,couldn t talk to her ?,2
she was not as beautiful .,no she was not as beautiful .,0
so you re going to be a grandfather .,and i m still just a lad myself .,3
take it easy that s bill .,tell bill to get the fuck off !,0
perfect and i like her charming eyes too .,what s the color of her eyes ?,0
this thing s going nowhere .,if this is someone s idea of a joke,2
yes i am the guy . . .,what a bummer ! you set me up ?,0
sandy ? . . . sandy please .,i ll get a coat for her .,1
i broke the man out of prison,i ll always be grateful mr . luthor .,2
shit ! the house is on fire !,and your children all gone .,2
well i think i ve had enough .,getting too hot in here for you ?,2
the vegetables seem to not be very fresh .,mine aren t so good either .,0
yes that s right .,is there anything else sir ?,0
no . i can help you .,i don t understand .,1
how old is he ?,i think he s or .,4
what s that ? a hundred ?,that s right harry .,2
what isn t happening ?,let me out of here !,0
where the hell were you ?,i had you covered . from back there .,4
no this is pretty much it .,you guys wanna get some coffee ?,0
yes i bought a few things .,what did you buy ?,0
doesn t she look scared ?,y know i don t really know her .,0
i don t know why .,why don t you give them a suggestion ?,0
what kind do you want ?,i want some chocolate .,0
aye i knew you were .,what s that mean ?,4
is it something you ve done ?,it s something i do . . .,2
hey relax i m not gonna break it .,give it to me !,2
what have you been doing ?,i ve been working too .,1
you called me jeffrey .,i did . are you ?,4
no i am still single .,can you tell me something about your family ?,0
you have stayed here for nights that s .,here is the money .,0
it does . feels right .,then it s a good thing .,4
yeah i loved that art class .,i see that you re pretty talented .,0
my daughters yes my daughters .,is that mrs . preysing .,0
will you come soon ?,soon as i finish .,0
get the fuck outta here !,i m a married man .,2
i can help you . . .,who is in authority here ?,3
oh you actually do that ?,every so often i do .,0
that s not fair .,why can t we be together ?,4
that makes me nervous .,it s fun meeting new people .,0
he s inside the house ?,why did he go in the house ?,2
the fruit and vegetables are over there .,pork . where s the meat counter ?,0
what do you think of your present job ?,i find it interesting .,0
and let my cry come unto thee .,the lord be with you .,3
it s been hell .,same sauce sweet and sour .,4
i think that you know .,maybe . . .i don t . . .,1
no . i should go .,please . please stay .,2
want to meet for lunch this saturday ?,sorry i can t . i m busy .,0
of course doctor i understand .,fine . thank you mr . franklin .,2
isn t he . . .,it s . . .,2
case . . . are you alright ?,yeah . . . yeah i m fine .,2
so since when is your house a bank ?,what do you mean ?,0
let me check . yes .,ok . i will take it .,0
that s a lie !,you never worked berlin . . .,3
perhaps it s the starter then ?,yes that s possible .,0
where s that deputy ?,be here in a minute .,2
it s not my time of month .,should you see a doctor ?,0
what s it to you ?,can i use some ?,1
why do you have to leave early ?,i am not feeling well .,0
how many languages can you speak ?,besides chinese i can speak english and french .,0
are you a secret service man ?,why do you ask ?,4
why can i learn it ?,don t worry do it step by step .,0
how long was she in there ?,maybe a minute . she came right out .,3
no it s nothing like that .,well what ? is he dangerous ?,2
i d really like a salad with chicken .,chicken salads are really good .,0
but it s a responsibility . . .,but it s a responsibility being a berserk .,4
i hear they re closing that post down .,september that s all she wrote .,2
i ve gotten about six .,have you paid all your tickets off ?,0
what can i help you with today ?,i would like to make a deposit .,0
i had you pegged didn t i ?,you had the whole human race pegged .,1
i m here for my appointment .,what can i do for you today ?,0
the next beginning class starts on october th .,what time is the class ?,0
did he telephone again ?,no he didn t !,0
hello sir . it s david .,david . . . sorry i m late .,2
nice to meet you .,oh and i need to talk to you .,0
that doesn t bother me .,you think this is funny ?,1
do you have a girlfriend ?,i am alone in the world .,0
no i want the fish .,our special tonight is lobster .,0
what would you let me do now ?,you are free . you can go now .,1
i like peach blossom because i like spring .,peach blossom is really beautiful .,1
i remember that speech really well .,i had you pegged didn t i ?,1
why are you here ? ?,shit ! bela what s with the gun ?,4
there is dial up or del .,which one do you feel is best ?,0
he found you didn t he ?,get on the bus .,3
i don t believe we ve met .,no i don t think we have .,0
what ? what do you mean ?,he said you didn t have one .,4
yes . what s the fare ?,for a single ticket .,0
i want to watch you work .,i ll consider it .,3
would that be a problem ?,is it a problem for you to ask ?,2
you re a pig .,why d you hit me ?,2
what s the problem ?,i m doing the best i can !,4
thank you captain sulu .,don t mention it captain kirk .,2
this morning was good .,the hat business is in trouble .,4
what happened to her where did she go ?,don t know just that she was afraid,2
i don t want to lose you .,what if i create a position for you ?,0
the general manager of your section .,what are the benefits ?,0
it wasn t that serious . . .,maybe you don t think murder s serious,3
he s saying what are you saying bobby ?,tell it with . . .,0
may i help you with something ?,i would like to return these books .,0
ladies and gentlemen . . .,welcome to the greatest show on earth .,2
can you see that road side help ?,yes we are going to across real road .,0
and nobody else can do that ?,not the way i can .,3
honey go back to sleep please !,goddammit ! i been sleeping for three years !,4
we re redecorating our living room .,what are you going to do to it ?,0
no ! we re almost through !,don t be insane stop ! full stop !,2
ray we got the shotguns .,i don t own no shotguns .,0
ok i will remember .,all these should be enough . good luck !,0
right ! i ll do it straight away .,thanks a lot . i m most grateful .,0
morning radar . how were things ?,splendid sir . no problems .,3
hey where you going ?,i ve got things to do .,2
i was happy to help .,it was so kind of you .,1
why am i here ?,i was lonely . . .,4
how often do you exercise ?,well i walk every day .,0
ahh then she s still alive .,she s fine . please,1
but you can t stay you know that ?,didn t think i could .,4
has caesar ever seen him ?,he does it right in front of him .,4
i d like to cash this check please .,do you have an account with us ?,0
jerry told me he bit your nose .,and what did i say ?,2
you ll whip me !,when did i ever ?,2
is my wife in the air ?,she should be shortly .,3
are you sure they re here ?,if evelyn s here the rest are here !,2
nice to meet you .,that s a sharp jacket .,4
if you like you can apply right now .,that would be great .,0
how s it going ?,i m fine thank you .,0
everything s fine pop .,last time you said that the renaissance happened .,2
do you have a moment ?,sure . what do you need ?,0
how much time do we have ?,not enough what do you want ?,2
hi this is maria . is that shirley ?,hi maria this is shirley .,0
you re sometimes not sure ?,i m sure . pretty sure .,4
i thought they came with batteries .,i can t believe you didn t check .,4
clever of you to find this spot betty .,it pays to know your way around oliver .,4
when does the bus come ?,you just missed one .,0
do you feel better now ?,i don t really feel too well yet .,0
would you like to get in shape together ?,what do you have in mind ?,0
yes you get off at the square .,how long is the ride ?,0
no . what are you gonna do ?,make dat money . get paid .,1
i m not finished yet .,go on . . .,1
how are you doing today ?,i m doing great . what about you ?,0
it really does i can t wait .,what time does the party start ?,0
you d recognize it if you tasted it .,i doubt it darling .,1
i m sorry . . .,don t worry about it jack . . .,2
somebody s taking a shower down there .,that d be lily .,2
i don t care for him .,he s your brother .,4
i have had some really horrible headaches lately .,how long have your headaches been going on ?,0
you forgot it last year as well .,i know i m sorry .,2
jesse please let s talk about this !,i m okay . just leave me alone .,4
you never did it on your own .,it took three of us to move it .,0
what would you like to be ?,what i m not .,1
who s the owner ?,here he comes right now .,0
what the hell ! ! !,i could have been better !,2
eight and a half .,eight and a half ?,1
really ! you live in taiwan !,yes . why not ?,0
because i don t think i m crazy .,you re not crazy .,4
and who runs it ?,i already told you .,0
can i help you sir ?,i want to have a haircut .,0
it s uh it s under twenty five .,it s under . . .,1
you ve got three broken ribs man !,i ve got my duties to attend to .,3
what are you doing ?,it wants me . i have to go .,2
it wasn t always like this you know .,what do you mean ?,0
i ain t a idiot asshole .,i ll see you tonight .,4
in the arctic ice .,that way . i can feel the cold .,4
wow this car can really burn rubber .,it s a great feeling .,1
i need the wayne diamonds .,we gonna trap ourselves a snowman ?,2
aw god ross . oh .,i ll do it .,0
who d you think it was ?,i thought it was dave .,2
i know you smoke weed right ?,why you say that ?,2
is it far from here ?,no it s not far .,0
did you get your learner s permit yet ?,i have it already .,0
at p . m .,i ll go in time thank you .,1
he had no reason to .,carl ever say u he u got one ?,4
i might be able to help . . .,i m sure you have great connections .,0
it s one of these .,we re going to freeze to death .,4
maybe someone took it .,will you be getting another copy anytime soon ?,0
sometimes if there s music playing .,what kind of dancing do you like ?,0
yeah i know what you mean .,one time i tried garlic ice cream .,0
come on terry we got a ride !,jesus what a rude person . . .,1
the brakes are shot .,i ve taken that into consideration .,2
i ve told you .,but i don t understand,4
what you thinking of hon ?,i m thinking of your man .,4
chief says he has a god .,. . . and also to bring medicine .,2
what are we talking about ?,yes . what are you implying ?,3
i ll take care of it .,where can we go ?,1
i didn t say nothin boss .,well whatta we got here ?,2
do you really need to ?,yes . is it ok with you ?,0
he s not a loser at all !,oh he s such a loser !,1
how old is keith ?,he s . how old is james ?,0
i always catch this bus .,how long is this bus ride ?,0
how far to the station ?,three or four miles . . .,4
what did he say ?,i think he called you beautiful .,0
how are you feeling about work ?,let s not talk about that now .,2
i ve seen it .,on the back it has,4
we check every four days .,why four ? and not three or five ?,2
and what do you do ted ?,me ? i m in the car business .,0
yes i ve just come back from scotland .,where did you visit ?,0
i told you to shut up .,prepare yourself drew i am,2
you think i m crazy .,i think you re different .,2
have you got anything to declare madam ?,no i haven t .,0
i just wanted some make up .,all that shit s on aisle .,2
don t push me away .,i had an abortion two weeks ago .,4
where will you go now ?,it will end tonight .,2
i have a meeting this afternoon .,when will it begin ?,0
she s washing her clothes .,well go tell her it s me okay ?,3
doctor save my baby please,what symptoms does he have ?,0
please don t cry . please honey .,what are you sorry for ?,2
i u must u go .,i m crazy about you !,1
hi bill i saw your grandma yesterday .,oh where was that ?,0
had to be done .,no good options left ?,0
we had a fantastic time .,did you go to the magic kingdom ?,0
a little . . .,is there a normal or year old boy ?,2
we ll take em in the morning .,i you ll i take him .,4
that s right of course .,don t feel so concerned jerry .,4
oh there you are .,oh ! you caught me .,2
where s the surprise ?,you want your surprise ?,3
can i help you ?,i want a leather jacket .,0
cindy let me . . .,no buddy i m the one he wants .,1
i m so happy for you !,how d it go at the trial ?,4
it s just insurance .,that s what i m talking about .,4
okay i will try it on .,it looks good on you .,0
i believe in that system . . .,do you ? really ?,3
oh it s jack . excuse me .,wow ! good timing .,0
how do you do mr . leland ?,are they standing for me ?,2
i guess we ll see just around .,ye i hope so .well .take it easy .,0
i m fine . what s up ?,i came here to let you go . .,2
how much is a soft ?,dollars .and for a hard one only dollars .,0
this is a nice car .,yeah . it s my sister s .,3
right . wait . a toast .,you re just afraid to eat it .,0
yeah . she is pretty good .,yeah . she is pretty good .,4
what was she running from ?,i don t know .,2
please put your name on this list .,then what do i need to do ?,0
maybe so . . .,i wouldn t give up your day job .,2
benjamin what s happening ?,hurry up . put your shoes on .,2
i don t understand why you do that .,why i do what ?,1
yeah i will . see you then !,o . k . see you .,1
don t curse in front of it .,why should i submit ?,2
let s try a little harder shall we ?,will you give me a break ?,4
are we gonna buy this house ?,do you have enough money ?,4
these people ll scooch down .,you guys ll scooch won t you ?,0
it s very pleasant .,what s the weather like in spring ?,0
then i will buy some tomorrow .,why do you want to buy so much ?,0
my present pay is rib yuan each month .,what s your expected salary ?,0
quit . he s too good .,charlie i m gonna take him .,2
it s nice of you to say so .,i really appreciate you for having invited me .,1
you gotta help me out this time buddy .,another tough thing i guess .,0
and he was ripped limb from limb ?,i m sure they were exaggerating .,3
i d like to reserve a room .,which date would that be ?,0
what re you doing ?,this isn t about us .,2
what about your job ?,i have vacation time coming to me .,0
that s not my handwriting .,you ve just said you signed it .,4
that is a picture nothing more .,you mean we are not children of satan ?,1
she s not quite twenty five .,do you miss your family ?,0
elvis i like too .,oh yeah he s good .,4
that s ok . is breakfast included ?,yes breakfast is included and parking is available .,0
i don t know .,which way did she fall ?,3
and you will come to hear us tonight ?,if it s at all possible,2
and no one will know the truth .,what is the truth ?,0
i had to mail in an absentee ballot .,why d you have to do that ?,0
can you make it ?,what time does it start ?,0
and how s your job ?,the job s okay .,2
that would be fine .,okay mr . horn see you tomorrow at .,0
sometimes it can be pretty hard to locate .,thank you dad i got it .,4
thank you for saving my life .,that s what they pay me for .,3
hey how s it going ?,not good . i lost my wallet .,0
i m sure you re overreacting .,i don t think so .,2
she looks like she stinks .,cat fight cat fight .,1
well i m back .,aye . glad to see you back lad .,2
hello . excuse me .,yes . can i help you ?,0
can i get a beer .,hey did you pick a roommate ?,0
i would like to book a table for .,ok sir . when will you be there ?,0
what s the problem ?,i want to talk now .,2
i quit two days ago brian .,what ll you do ?,2
where s my mother ?,i dropped her at home .,4
why not . . . ?,no one s ever asked me that before .,2
mr . li the report has been finished .,so fast ! thank you .,0
there it is . i m broke .,ah that s unfortunate mr . felson .,3
how s it going ?,maybe i m going too fast .,4
no i transferred here .,what school did you come from ?,0
in case you get back before i do .,where are you going ?,4
how s the book ?,it ll be out later this year .,1
i don t know .,you were just curious ?,1
what the fuck is wrong with you ?,think about how we got here !,2
hello this is back .,hi is this jack ?,1
where did you get that ?,you won t believe it ! guess !,1
and i m afraid we want it back .,but i don t have it .,4
shall we move closer to the fire ?,yes an excellent idea .,1
jimmy did you touch her ?,i don t know .,2
hi martha . everything is perfect .,are you enjoying married life ?,1
no i don t .,would you like to open the suitcase please ?,0
you won t forget it ?,i won t forget .,1
sid i can see you !,where are you dewey ?,4
we re fine . turkey sandwiches .,well for later then .,0
i swear . on my life .,swear on my life .,4
when did you last see him .,november the th last year .,3
don t do it rob !,he s not worth it !,0
what s the rent for a year ?,yuan including water but electricity and gas .,0
we re not ready .,hip alternative types who will understand the process better,0
of course they are out there .,but i never saw them .,0
my ass if falling .,your what . . . ?,1
when will he be home major ?,four weeks or so right around halloween .,3
what seems to the trouble mr brown ?,i m in pretty bad shape doctor ford .,0
you should call her .,i will . see ya !,3
maybe we should just listen to the radio .,sorry . it only plays static .,3
it s uh it s a song .,the laundry song that we sing .,0
whatever happened to mary ?,i told you her family moved to miami .,0
i loved you . i loved,grant you re sick !,0
i don t think so .,you re sure . find out for me .,3
yeah . well you re okay ?,yeah thanks for keeping an eye out .,2
oh my poor baby .,oh . mom . it s brad .,2
no he got hit by a bus .,oh . . . can i help you ?,4
i bet you had to drag him away .,he wanted to take it home yesterday .,0
why the hell didn t you do anything ?,what was i supposed to do ?,0
what can i do for you ?,i need some medicine .,0
you don t think you could be wrong ?,i am absolutely sure i m right .,0
hi i d like to return this radio .,all right . do you have the receipt ?,0
where did you get that alcohol ?,i packed it . just for us .,0
where do you want to go ?,i think we should go out to eat .,0
i couldn t have slept tonight anyhow .,you re leaving tomorrow ?,0
show me the black one my size .,ok here you are .,0
which do you like better orange or lemon ?,i like orange better .,0
one of them u is u a cop .,what makes you say that ?,3
no i m not .,what s your job ?,0
why in the world can t you ?,he hates all my race .,4
thank you b for your time .,thank you and goodbye .,0
because you re the closest .,i m not any closer than you are .,2
i just want to know that s all .,what difference does it make ?,4
what time are you leaving ?,i ll leave at o clock .,1
sounds risky to me .,you getting cold feet ?,4
i can t stay here though .,that s really not my problem .,0
i didn t feel well . . .,let me take you to the hospital .,4
he ain t dead .,so what is it ?,2
you want to go to a movie tonight ?,i thought your mom s coming up ?,3
i like to remember things my own way .,what do you mean by that ?,3
they won t come anyway .,what do you mean they won t come ?,4
good to see you .,is there someplace we can talk ?,1
will she be angry ?,she made me promise not to .,0
what s her personality like ?,she s a lot like me .,0
they re nice guys .,oh they re firemen guys .,1
no i don t .,i got you those trousers from paul smith .,3
is sandy part of this ?,no not at all .,4
ally . that was my nickname .,ally . that s right .,4
how much do are you looking to spend ?,i can only afford about yuan a month .,0
where d you get those ?,i found them at pennies .,1
the driver will . . .,but i speak english .,1
straight to the pole at almost fifty knots !,nothing we can do now .,4
how old am i ?,i don t know .,0
i live in room of the friendship hotel .,ok someone will be there by .,0
we re leaving in three hours .,i need your help .,2
i can check and call you back .,thank you . i m at .,1
you should go get yours .,yeah i think i will .,0
i want to transfer .,i ll do that right now .,1
can i see your id ?,no i left it in the car .,0
i m all ears .,i want you to murder me .,1
who gave my dog this cooked chicken bone ?,i did . why ?,0
i think there s someone at the door .,excuse me while i go and get that .,0
yeah . what about him ?,turns out he s connected .,4
beautiful day isn t it ?,yes yes it is .,2
no problem . i ll tell you .,i ll appreciate it very much .,0
guess spock . your best guess .,guessing is not in my nature . . .,2
